{
  "$schema": "https://json-schema.org/draft/2020-12/schema",
  "type": "object",
  "required": [
    "version",
    "sources"
  ],
  "additionalProperties": false,
  "properties": {
    "version": {
      "type": "string",
      "minLength": 1
    },
    "description": {
      "type": "string"
    },
    "policy": {
      "type": "string"
    },
    "sources": {
      "type": "array",
      "minItems": 1,
      "items": {
        "$ref": "#/$defs/source"
      }
    }
  },
  "$defs": {
    "paths": {
      "type": "array",
      "uniqueItems": true,
      "items": {
        "type": "string",
        "pattern": "^/",
        "minLength": 2
      }
    },
    "source": {
      "type": "object",
      "additionalProperties": false,
      "required": [
        "id",
        "publisher",
        "kind",
        "enabled",
        "required",
        "adapter",
        "url",
        "allowed_hosts",
        "path_prefix",
        "max_pages",
        "max_items",
        "fetch_articles"
      ],
      "properties": {
        "id": {
          "type": "string",
          "pattern": "^[a-z][a-z0-9_]*$"
        },
        "publisher": {
          "type": "string",
          "minLength": 1
        },
        "kind": {
          "enum": [
            "primary",
            "analysis",
            "secondary"
          ]
        },
        "enabled": {
          "type": "boolean"
        },
        "required": {
          "type": "boolean"
        },
        "adapter": {
          "enum": [
            "rss",
            "govpl",
            "pansa",
            "rso",
            "x_browser_import",
            "curated_documents",
            "x_api_import",
            "telegram_public",
            "public_bulletins"
          ]
        },
        "url": {
          "type": "string",
          "pattern": "^https?://"
        },
        "allowed_hosts": {
          "type": "array",
          "minItems": 1,
          "uniqueItems": true,
          "items": {
            "type": "string",
            "minLength": 1
          }
        },
        "path_prefix": {
          "type": "string",
          "pattern": "^/"
        },
        "additional_path_prefixes": {
          "$ref": "#/$defs/paths"
        },
        "max_pages": {
          "type": "integer",
          "minimum": 1,
          "maximum": 10
        },
        "max_items": {
          "type": "integer",
          "minimum": 1,
          "maximum": 100
        },
        "max_requests": {
          "type": "integer",
          "minimum": 1,
          "maximum": 100
        },
        "fetch_articles": {
          "type": "boolean"
        },
        "article_parser": {
          "const": "osw"
        },
        "max_backfill_items": {
          "type": "integer",
          "minimum": 0,
          "maximum": 10
        },
        "notes": {
          "type": "string"
        },
        "archive_url": {
          "type": "string",
          "const": "https://www.osw.waw.pl/pl/publikacje"
        },
        "account": {
          "enum": [
            "sentdefender",
            "osinttechnical"
          ]
        },
        "max_capture_age_hours": {
          "type": "integer",
          "minimum": 1,
          "maximum": 24
        },
        "document_parser": {
          "enum": [
            "lv_mod",
            "lv_vdd"
          ]
        },
        "document_urls": {
          "type": "array",
          "minItems": 1,
          "maxItems": 6,
          "uniqueItems": true,
          "items": {
            "type": "string",
            "pattern": "^https://"
          }
        },
        "filter": {
          "type": "object",
          "additionalProperties": false,
          "required": [
            "regions",
            "broad_context",
            "outside_locations",
            "topics"
          ],
          "properties": {
            "regions": {
              "type": "object",
              "minProperties": 1,
              "additionalProperties": {
                "type": "array",
                "minItems": 1,
                "uniqueItems": true,
                "items": {
                  "type": "string",
                  "minLength": 2,
                  "maxLength": 80
                }
              }
            },
            "broad_context": {
              "type": "object",
              "minProperties": 1,
              "additionalProperties": {
                "type": "array",
                "minItems": 1,
                "uniqueItems": true,
                "items": {
                  "type": "string",
                  "minLength": 2,
                  "maxLength": 80
                }
              }
            },
            "outside_locations": {
              "type": "object",
              "minProperties": 1,
              "additionalProperties": {
                "type": "array",
                "minItems": 1,
                "uniqueItems": true,
                "items": {
                  "type": "string",
                  "minLength": 2,
                  "maxLength": 80
                }
              }
            },
            "topics": {
              "type": "object",
              "minProperties": 1,
              "additionalProperties": {
                "type": "array",
                "minItems": 1,
                "uniqueItems": true,
                "items": {
                  "type": "string",
                  "minLength": 2,
                  "maxLength": 80
                }
              }
            }
          }
        },
        "bulletin_parser": {
          "enum": [
            "cert_pl",
            "sg_podlaski"
          ]
        },
        "publication_feed_url": {
          "const": "https://moje.cert.pl/advisories/feed/"
        },
        "summary_query": {
          "const": "ЗБИТО"
        }
      },
      "allOf": [
        {
          "if": {
            "required": [
              "article_parser"
            ]
          },
          "then": {
            "required": [
              "max_backfill_items",
              "max_requests"
            ],
            "properties": {
              "id": {
                "const": "osw"
              },
              "adapter": {
                "const": "rss"
              },
              "fetch_articles": {
                "const": true
              },
              "max_pages": {
                "maximum": 3
              },
              "max_items": {
                "maximum": 30
              },
              "max_requests": {
                "maximum": 50
              }
            }
          }
        },
        {
          "if": {
            "properties": {
              "adapter": {
                "enum": [
                  "x_browser_import",
                  "x_api_import"
                ]
              }
            }
          },
          "then": {
            "required": [
              "account",
              "filter",
              "max_capture_age_hours"
            ],
            "properties": {
              "kind": {
                "const": "secondary"
              },
              "required": {
                "const": false
              },
              "fetch_articles": {
                "const": false
              }
            }
          }
        },
        {
          "if": {
            "properties": {
              "adapter": {
                "const": "curated_documents"
              }
            }
          },
          "then": {
            "required": [
              "document_parser",
              "document_urls",
              "max_requests"
            ],
            "properties": {
              "kind": {
                "const": "primary"
              },
              "required": {
                "const": false
              },
              "max_items": {
                "maximum": 6
              },
              "max_requests": {
                "maximum": 12
              }
            }
          }
        },
        {
          "if": {
            "properties": {
              "adapter": {
                "const": "telegram_public"
              }
            }
          },
          "then": {
            "properties": {
              "id": {
                "const": "ua_air_force_public"
              },
              "url": {
                "const": "https://t.me/s/kpszsu"
              },
              "max_requests": {
                "type": "integer",
                "minimum": 1,
                "maximum": 3
              },
              "max_pages": {
                "type": "integer",
                "minimum": 1,
                "maximum": 3
              },
              "max_items": {
                "maximum": 60
              },
              "fetch_articles": {
                "const": false
              },
              "required": {
                "const": false
              }
            }
          }
        },
        {
          "if": {
            "properties": {
              "adapter": {
                "const": "public_bulletins"
              }
            }
          },
          "then": {
            "required": [
              "bulletin_parser",
              "max_requests"
            ],
            "properties": {
              "kind": {
                "const": "primary"
              },
              "fetch_articles": {
                "const": true
              },
              "max_pages": {
                "maximum": 3
              },
              "max_items": {
                "maximum": 30
              },
              "max_requests": {
                "maximum": 35
              }
            }
          }
        }
      ]
    }
  }
}
